<?xml version="1.0" encoding="UTF-8"?>
<?xml-stylesheet type="text/xsl" href="clasificacion.xsl"?>
<clasificacion xmlns:xsi="http://www.w3.org/2001/XMLSchema-instance" xsi:noNamespaceSchemaLocation="../xml/clasificacion.xsd" temp="temporada 1">
    
    <posicion num="1">
        <equipo>
            <escudo>bilbao.png</escudo>
            <nombre>Bilbao</nombre>
        </equipo>
        <puntos>3</puntos>
        <jugados>1</jugados>
        <ganados>1</ganados>
        <empatados>0</empatados>
        <perdidos>0</perdidos>
        <goles-favor>4</goles-favor>
        <goles-contra>2</goles-contra>
    </posicion>
    <posicion num="2">
        <equipo>
            <escudo>Barcelona.png</escudo>
            <nombre>Barcelona</nombre>
        </equipo>
        <puntos>0</puntos>
        <jugados>1</jugados>
        <ganados>0</ganados>
        <empatados>0</empatados>
        <perdidos>1</perdidos>
        <goles-favor>2</goles-favor>
        <goles-contra>4</goles-contra>
    </posicion>
    <posicion num="3">
        <equipo>
            <escudo>madrid.png</escudo>
            <nombre>Madrid</nombre>
        </equipo>
        <puntos>0</puntos>
        <jugados>0</jugados>
        <ganados>0</ganados>
        <empatados>0</empatados>
        <perdidos>0</perdidos>
        <goles-favor>0</goles-favor>
        <goles-contra>0</goles-contra>
    </posicion>
    <posicion num="4">
        <equipo>
            <escudo>zaragoza.png</escudo>
            <nombre>Zaragoza</nombre>
        </equipo>
        <puntos>0</puntos>
        <jugados>0</jugados>
        <ganados>0</ganados>
        <empatados>0</empatados>
        <perdidos>0</perdidos>
        <goles-favor>0</goles-favor>
        <goles-contra>0</goles-contra>
    </posicion>
    <posicion num="5">
        <equipo>
            <escudo>salamanca.png</escudo>
            <nombre>Salamanca</nombre>
        </equipo>
        <puntos>0</puntos>
        <jugados>0</jugados>
        <ganados>0</ganados>
        <empatados>0</empatados>
        <perdidos>0</perdidos>
        <goles-favor>0</goles-favor>
        <goles-contra>0</goles-contra>
    </posicion>
    <posicion num="6">
        <equipo>
            <escudo>sevilla.png</escudo>
            <nombre>Sevilla</nombre>
        </equipo>
        <puntos>0</puntos>
        <jugados>0</jugados>
        <ganados>0</ganados>
        <empatados>0</empatados>
        <perdidos>0</perdidos>
        <goles-favor>0</goles-favor>
        <goles-contra>0</goles-contra>
    </posicion>
</clasificacion>